{
  "schema_version": "native-provider-registry-v1",
  "canonical_profile": "schuss-canonical-json-v1",
  "registry_version": "schuss-rt-factory-registry-v1",
  "runtime_abi": "schuss-rt-abi-v1",
  "numeric_profile": "schuss-host-q27-reference-v0",
  "provider_reference": {
    "implementation_provider_id": "schuss-implementation-provider-000001",
    "revision": 1,
    "content_hash": "sha256:979084f654699fe87db4dd7f33c12123f25d490d630942df6ca5222ae166344c"
  },
  "factory_count": 7,
  "callback_constraints": [
    "no-allocation",
    "no-filesystem",
    "no-locking",
    "no-network",
    "no-process-control"
  ],
  "generated_outputs": [
    "packages/schuss_core/generated_native_registry.py",
    "packages/schuss_rt/src/runtime_v1.cpp",
    "schemas/host-runtime-observation-v1.schema.json",
    "schemas/host-runtime-package-v1.schema.json"
  ],
  "preserved_tree_hashes": {
    "contracts/task031": "0a7e40cd9dc7a33cfad3287d26ddab710c1a762ec02755d92a02ba8af9ad94c4",
    "contracts/task032": "62ecd0b44326d64ecff5cb4a82b90fb16c0d5486c5281d9a48cd04633a455152",
    "evidence/task032-completion-v1": "642f6495dc3b81a53373b123fe3a62a7310ac98366ea1f7b7ffc8239364c436c",
    "fixtures/task031": "90efe89a1458561703532d0aa1c447023ffdc7418e44e7cb7509fbac016011c7",
    "fixtures/task032": "8bb01690b71d1b743527fd216e96ac0b1a14883d81b14a6d128a693e4aaf6a45"
  },
  "factories": [
    {
      "role": "saw",
      "provider_binding_id": "provider-binding-000001",
      "contract_reference": {
        "component_contract_id": "schuss-component-contract-000012",
        "revision": 1,
        "content_hash": "sha256:3f399547dbe7a1a76bdcedc1d1d886ccd49d0620fdbca3fbace6aac0a9d2292c"
      },
      "implementation_binding_reference": {
        "implementation_id": "schuss-implementation-000162",
        "revision": 2,
        "content_hash": "sha256:e928bf31a0b4427d6c960d4a0d29b181912aa20635ff244673d784e3f66a413f"
      },
      "target_reference": {
        "compute_target_id": "schuss-compute-target-000002",
        "revision": 1,
        "content_hash": "sha256:8e66c6e40db0215c69c44852f6838a289342f372379262b87acc4a2bb49bd290"
      },
      "backend_reference": {
        "backend_id": "schuss-backend-000003",
        "revision": 1,
        "content_hash": "sha256:c188a702201625cbf32d49976ce54a06194dea89d3815e972e319f4b6199a116"
      },
      "factory_id": "schuss.rt.saw-q27-v0",
      "inputs": [{"facet_id": "component-port-000001", "fractional_bits": 21}],
      "outputs": [{"facet_id": "component-port-000002", "fractional_bits": 27}],
      "parameter_facets": ["component-parameter-000001"],
      "state": {"size_bytes": 16, "alignment_bytes": 16},
      "lifecycle": {
        "prepare_symbol": "prepare_generic",
        "reset_symbol": "reset_zero",
        "event_symbol": "event_parameter",
        "process_symbol": "process_saw"
      }
    },
    {
      "role": "pwm",
      "provider_binding_id": "provider-binding-000002",
      "contract_reference": {
        "component_contract_id": "schuss-component-contract-000013",
        "revision": 1,
        "content_hash": "sha256:2c4d15d5228dadfbf9c5ecb8734e7207b7157fc8960fb4100b461b59f859daa0"
      },
      "implementation_binding_reference": {
        "implementation_id": "schuss-implementation-000163",
        "revision": 2,
        "content_hash": "sha256:f4a9f8f06aaf286860dc31e3bf4faf1b60b786e925a307a1e3641bc576601df2"
      },
      "target_reference": {
        "compute_target_id": "schuss-compute-target-000002",
        "revision": 1,
        "content_hash": "sha256:8e66c6e40db0215c69c44852f6838a289342f372379262b87acc4a2bb49bd290"
      },
      "backend_reference": {
        "backend_id": "schuss-backend-000003",
        "revision": 1,
        "content_hash": "sha256:c188a702201625cbf32d49976ce54a06194dea89d3815e972e319f4b6199a116"
      },
      "factory_id": "schuss.rt.pwm-q27-v0",
      "inputs": [
        {"facet_id": "component-port-000001", "fractional_bits": 21},
        {"facet_id": "component-port-000002", "fractional_bits": 27}
      ],
      "outputs": [{"facet_id": "component-port-000003", "fractional_bits": 27}],
      "parameter_facets": ["component-parameter-000001"],
      "state": {"size_bytes": 16, "alignment_bytes": 16},
      "lifecycle": {
        "prepare_symbol": "prepare_generic",
        "reset_symbol": "reset_zero",
        "event_symbol": "event_parameter",
        "process_symbol": "process_pwm"
      }
    },
    {
      "role": "soft",
      "provider_binding_id": "provider-binding-000003",
      "contract_reference": {
        "component_contract_id": "schuss-component-contract-000016",
        "revision": 1,
        "content_hash": "sha256:c98e44b172cf256439edfe2f51c15499f29ffe39900d9f8de72c339e346762e2"
      },
      "implementation_binding_reference": {
        "implementation_id": "schuss-implementation-000164",
        "revision": 2,
        "content_hash": "sha256:5444c071225361d2cff4542406fc17d4ecbfd7396884285d1a776f7c51bde7be"
      },
      "target_reference": {
        "compute_target_id": "schuss-compute-target-000002",
        "revision": 1,
        "content_hash": "sha256:8e66c6e40db0215c69c44852f6838a289342f372379262b87acc4a2bb49bd290"
      },
      "backend_reference": {
        "backend_id": "schuss-backend-000003",
        "revision": 1,
        "content_hash": "sha256:c188a702201625cbf32d49976ce54a06194dea89d3815e972e319f4b6199a116"
      },
      "factory_id": "schuss.rt.soft-q27-v0",
      "inputs": [{"facet_id": "component-port-000001", "fractional_bits": 27}],
      "outputs": [{"facet_id": "component-port-000002", "fractional_bits": 27}],
      "parameter_facets": [],
      "state": {"size_bytes": 0, "alignment_bytes": 1},
      "lifecycle": {
        "prepare_symbol": "prepare_generic",
        "reset_symbol": "reset_zero",
        "event_symbol": "event_parameter",
        "process_symbol": "process_soft"
      }
    },
    {
      "role": "smooth",
      "provider_binding_id": "provider-binding-000004",
      "contract_reference": {
        "component_contract_id": "schuss-component-contract-000015",
        "revision": 1,
        "content_hash": "sha256:705b8e11c00d985eb8fd010a2d3fd71cb891f00711ad647b0746cdfb90c6ff81"
      },
      "implementation_binding_reference": {
        "implementation_id": "schuss-implementation-000165",
        "revision": 2,
        "content_hash": "sha256:ba3859246c68f72a9c4c14ad8ccdbbac4273bcccb69f85eb1ffb100ec0db5a83"
      },
      "target_reference": {
        "compute_target_id": "schuss-compute-target-000002",
        "revision": 1,
        "content_hash": "sha256:8e66c6e40db0215c69c44852f6838a289342f372379262b87acc4a2bb49bd290"
      },
      "backend_reference": {
        "backend_id": "schuss-backend-000003",
        "revision": 1,
        "content_hash": "sha256:c188a702201625cbf32d49976ce54a06194dea89d3815e972e319f4b6199a116"
      },
      "factory_id": "schuss.rt.smooth-q27-v0",
      "inputs": [{"facet_id": "component-port-000001", "fractional_bits": 27}],
      "outputs": [{"facet_id": "component-port-000002", "fractional_bits": 27}],
      "parameter_facets": ["component-parameter-000001"],
      "state": {"size_bytes": 8, "alignment_bytes": 8},
      "lifecycle": {
        "prepare_symbol": "prepare_generic",
        "reset_symbol": "reset_zero",
        "event_symbol": "event_parameter",
        "process_symbol": "process_smooth"
      }
    },
    {
      "role": "crossfade",
      "provider_binding_id": "provider-binding-000005",
      "contract_reference": {
        "component_contract_id": "schuss-component-contract-000003",
        "revision": 1,
        "content_hash": "sha256:96a29faf58769be5f2ac52de07aa80cae3dcdff28f0f3c158fb1fd12cc234a8d"
      },
      "implementation_binding_reference": {
        "implementation_id": "schuss-implementation-000166",
        "revision": 2,
        "content_hash": "sha256:31c327556140c1dc8fed576ffcaa456d0987921cf274f0b8f04e180a2c7be597"
      },
      "target_reference": {
        "compute_target_id": "schuss-compute-target-000002",
        "revision": 1,
        "content_hash": "sha256:8e66c6e40db0215c69c44852f6838a289342f372379262b87acc4a2bb49bd290"
      },
      "backend_reference": {
        "backend_id": "schuss-backend-000003",
        "revision": 1,
        "content_hash": "sha256:c188a702201625cbf32d49976ce54a06194dea89d3815e972e319f4b6199a116"
      },
      "factory_id": "schuss.rt.crossfade-q27-v0",
      "inputs": [
        {"facet_id": "component-port-000001", "fractional_bits": 27},
        {"facet_id": "component-port-000002", "fractional_bits": 27},
        {"facet_id": "component-port-000003", "fractional_bits": 27}
      ],
      "outputs": [{"facet_id": "component-port-000004", "fractional_bits": 27}],
      "parameter_facets": [],
      "state": {"size_bytes": 0, "alignment_bytes": 1},
      "lifecycle": {
        "prepare_symbol": "prepare_generic",
        "reset_symbol": "reset_zero",
        "event_symbol": "event_parameter",
        "process_symbol": "process_crossfade"
      }
    },
    {
      "role": "vca",
      "provider_binding_id": "provider-binding-000006",
      "contract_reference": {
        "component_contract_id": "schuss-component-contract-000020",
        "revision": 1,
        "content_hash": "sha256:0cf9737582327560e82feb565fd3092993b750938a9669fc43305b5658ac5490"
      },
      "implementation_binding_reference": {
        "implementation_id": "schuss-implementation-000167",
        "revision": 2,
        "content_hash": "sha256:c05655fe1840bea79d9b6bf03e27231cea440ccde23f2ee7b75e5c5216893c28"
      },
      "target_reference": {
        "compute_target_id": "schuss-compute-target-000002",
        "revision": 1,
        "content_hash": "sha256:8e66c6e40db0215c69c44852f6838a289342f372379262b87acc4a2bb49bd290"
      },
      "backend_reference": {
        "backend_id": "schuss-backend-000003",
        "revision": 1,